{"v":"ACDC10JSON00018e_","d":"EJ-ir-FVnZWpSGC12fyEAXixqdQonQNATT5eteg2Qa-g","i":"ENiNAkQ09I2GgaAdDrao-ajKW8dMNfU8TeNJHguKSReN","ri":"EN49qjnmLZkR_F_yPs6b9VpXvQ38JSPEz3ZyWfLSlIHw","s":"ECJN2IjRhuWpNRFJaIhLbYAAbB-DjILDaQ3dEX7rfA9_","a":{"d":"ENKgdGAv9XDjAzDguwQ35aIVYRRtmZ5dMyfNnvx7gvmk","i":"EJr99nDia0loQCxHy-92PczvoLcyC1LMj224jB8Cde_W","dt":"2025-01-01T00:00:00.000000+00:00","capability":"sign"}}